{
  "method": "POST",
  "path": "/api/test",
  "query": {
    "id": {
      "!random": 1000
    },
    "encoded": {
      "!url_encode": "test value"
    }
  },
  "headers": {
    "Content-Type": "application/x-www-form-urlencoded",
    "X-Test-ID": {
      "!uuid": []
    }
  },
  "params": [
    {
      "key": "username",
      "value": "admin"
    },
    {
      "key": "password",
      "value": {
        "!base64_encode": "secret123"
      }
    },
    {
      "key": {
        "!concat": ["test_", {"!var": "suffix"}]
      },
      "value": {
        "!double_encode": "<script>alert('xss')</script>"
      }
    }
  ],
  "variables": {
    "suffix": {
      "!random_string": [8, "abcdef0123456789"]
    },
    "timestamp": {
      "!timestamp": []
    }
  }
}